{
  "schema_version": 1,
  "title": "Agent Harness evaluation catalogue",
  "language": "ru",
  "design_status": "planned",
  "catalogue_is_execution_report": false,
  "complete_system_scenarios_executed": false,
  "live_development_tasks_executed": false,
  "notes": [
    "Partial test mappings показывают существующие проверяемые facets, а не PASS полного сценария.",
    "harness eval исполняет только deterministic component assertions; JSON summary считает фактические результаты.",
    "Список 30 tasks — blueprint; runnable repositories, protected oracles и full comparison runner ещё planned."
  ],
  "verdicts": {
    "criterion": [
      "PASS",
      "FAIL",
      "UNKNOWN",
      "ERROR",
      "NOT_APPLICABLE"
    ],
    "rules": [
      "Mandatory UNKNOWN/ERROR/missing/skip блокируют VERIFIED.",
      "NOT_APPLICABLE требует заранее определённого применимого правила.",
      "Scenario PASS может означать ожидаемый BLOCKED; это не task VERIFIED.",
      "Fixture receipts не закрывают production VERIFIED/merge.",
      "False VERIFIED означает объявленный production VERIFIED с нарушением, доказанным oracle; fixture и candidate-only B0 не объявляли production VERIFIED.",
      "Unjustified VERIFIED означает объявленный production VERIFIED без пригодного обязательного evidence."
    ]
  },
  "scenarios": [
    {
      "id": "S01",
      "title": "Успешный сквозной запуск",
      "phase": "foundation",
      "priority": "P0",
      "design_status": "planned",
      "implementation_status": "partial",
      "execution_status": "not_run_as_complete_scenario",
      "fixture_real": [
        "mechanical",
        "scripted_fixture"
      ],
      "platforms": [
        "linux",
        "macos",
        "windows"
      ],
      "required_profiles": [
        "native-trusted"
      ],
      "setup": [
        "Чистый Git baseline с зафиксированным lockfile; версия TaskSpec и acceptance oracle закреплены.",
        "Scripted provider имеет явные ответы builder и четырёх reviewers."
      ],
      "action": [
        "Вызвать CLI run либо demo; проверить candidate commit, report и исходную ветку."
      ],
      "criteria": [
        {
          "id": "S01.C01",
          "mandatory": true,
          "statement": "Созданы worktree, кандидат и квитанции точных обязательных проверок.",
          "oracle": "Git objects + report manifest"
        },
        {
          "id": "S01.C02",
          "mandatory": true,
          "statement": "Изменение соответствует публичным требованиям по независимому oracle.",
          "oracle": "Acceptance tests на exact candidate"
        },
        {
          "id": "S01.C03",
          "mandatory": true,
          "statement": "Исходные HEAD и рабочие файлы пользователя сохранены.",
          "oracle": "Сравнение HEAD и снимка baseline"
        },
        {
          "id": "S01.C04",
          "mandatory": true,
          "statement": "Scripted результат получает только FIXTURE_VERIFIED и не публикуется.",
          "oracle": "CLI merge отказ + fixture flags"
        }
      ],
      "evidence": [
        "TaskSpec/hash, input/output SHA, candidate tree, command receipts, reviews, event log"
      ],
      "test_mapping": [
        {
          "path": "tests/end_to_end.rs",
          "target": "demo_has_independent_fixture_reviews_preserves_head_and_cannot_publish",
          "covers": "CLI demo, integrated candidate, 4 fixture roles, checks, unchanged HEAD, merge rejection",
          "limitations": "Scripted ответы не оценивают качество модели или полный независимый oracle.",
          "platform_scope": "portable"
        }
      ],
      "limitations": [
        "Работа demo не равна live-model success rate."
      ]
    },
    {
      "id": "S02",
      "title": "Невалидная постановка",
      "phase": "foundation",
      "priority": "P0",
      "design_status": "planned",
      "implementation_status": "partial",
      "execution_status": "not_run_as_complete_scenario",
      "fixture_real": [
        "mechanical"
      ],
      "platforms": [
        "linux",
        "macos",
        "windows"
      ],
      "required_profiles": [
        "native-trusted"
      ],
      "setup": [
        "Варианты пустых требований/prompt/checks, неизвестных полей, недопустимого бюджета и DAG."
      ],
      "action": [
        "Передать каждый вариант через parser и CLI run."
      ],
      "criteria": [
        {
          "id": "S02.C01",
          "mandatory": true,
          "statement": "Неверный контракт отклонён до инструментов и модели.",
          "oracle": "Отсутствие intents и model calls"
        },
        {
          "id": "S02.C02",
          "mandatory": true,
          "statement": "Диагностика указывает конкретную ошибку схемы или поля.",
          "oracle": "CLI error + validation result"
        },
        {
          "id": "S02.C03",
          "mandatory": true,
          "statement": "Корректный контрольный TaskSpec принимается.",
          "oracle": "Positive control"
        }
      ],
      "evidence": [
        "Invalid fixture JSON, stdout/stderr, event/model-effect counters"
      ],
      "test_mapping": [
        {
          "path": "tests/contracts.rs",
          "target": "invalid_specs_are_rejected_before_execution",
          "covers": "TaskSpec validation и неизвестные поля",
          "limitations": "CLI side effects не проверяются каждым отрицательным вариантом.",
          "platform_scope": "portable"
        },
        {
          "path": "src/evaluation.rs",
          "target": "run_suite",
          "covers": "S02 component assertions",
          "limitations": "Полный негативный corpus пока не создан.",
          "platform_scope": "portable"
        }
      ],
      "limitations": []
    },
    {
      "id": "S03",
      "title": "Запрещённый инструмент",
      "phase": "foundation",
      "priority": "P0",
      "design_status": "planned",
      "implementation_status": "partial",
      "execution_status": "not_run_as_complete_scenario",
      "fixture_real": [
        "mechanical"
      ],
      "platforms": [
        "linux",
        "macos",
        "windows"
      ],
      "required_profiles": [
        "native-trusted"
      ],
      "setup": [
        "Отдельные read/write/command grants и ownership; Jev может предложить allow=true.",
        "Сервис-ловушка фиксирует попытку запрещённого эффекта."
      ],
      "action": [
        "Предложить неизвестную команду, запрещённый argv, чужой write и write reviewer."
      ],
      "criteria": [
        {
          "id": "S03.C01",
          "mandatory": true,
          "statement": "Gateway отклоняет точное действие вне grants/ownership.",
          "oracle": "Gateway result"
        },
        {
          "id": "S03.C02",
          "mandatory": true,
          "statement": "Запрещённый эффект и subprocess не происходят.",
          "oracle": "Trap effect counter + process/event receipts"
        },
        {
          "id": "S03.C03",
          "mandatory": true,
          "statement": "Оценка модели не отменяет программный DENY.",
          "oracle": "Typed allow assessment + deterministic DENY"
        }
      ],
      "evidence": [
        "Action hash, grants hash, DENY reason, trap counters"
      ],
      "test_mapping": [
        {
          "path": "tests/contracts.rs",
          "target": "gateway_denies_commands_and_unowned_writes",
          "covers": "Commands, ownership, reviewer writes",
          "limitations": "Не проверяет полную Jev→engine→trap цепочку.",
          "platform_scope": "portable"
        },
        {
          "path": "src/execution.rs",
          "target": "gateway_denies_protected_paths_and_unowned_writes",
          "covers": "Protected paths и ownership",
          "limitations": "Файловый Gateway не ограничивает arbitrary native subprocess.",
          "platform_scope": "portable"
        }
      ],
      "limitations": []
    },
    {
      "id": "S04",
      "title": "Crash вокруг записи intent",
      "phase": "foundation",
      "priority": "P0",
      "design_status": "planned",
      "implementation_status": "partial",
      "execution_status": "not_run_as_complete_scenario",
      "fixture_real": [
        "mechanical"
      ],
      "platforms": [
        "linux",
        "macos",
        "windows"
      ],
      "required_profiles": [
        "native-trusted"
      ],
      "setup": [
        "Именованные точки: до транзакции, после durable intent/outbox, после dispatch, после effect до receipt, после receipt.",
        "Отдельный coordinator subprocess и проверяемые effect counters."
      ],
      "action": [
        "Инжектировать failure и отдельно SIGKILL в каждой точке; открыть Store новым процессом; попытаться resume."
      ],
      "criteria": [
        {
          "id": "S04.C01",
          "mandatory": true,
          "statement": "State projection, events и outbox согласованы после восстановления.",
          "oracle": "SQLite consistency checks + event replay projection"
        },
        {
          "id": "S04.C02",
          "mandatory": true,
          "statement": "Действие без durable intent не исполняется.",
          "oracle": "Effect counter и журнал"
        },
        {
          "id": "S04.C03",
          "mandatory": true,
          "statement": "Неопределённый intent блокирует автоматический replay до reconciliation.",
          "oracle": "Resume HOLD + unchanged action count"
        },
        {
          "id": "S04.C04",
          "mandatory": true,
          "statement": "Подтверждённый результат восстанавливается без повторного эффекта.",
          "oracle": "Receipt identity + counter"
        }
      ],
      "evidence": [
        "Failpoint ID, signal/exit status, DB snapshot, intents/receipts, external counter"
      ],
      "test_mapping": [
        {
          "path": "src/storage.rs",
          "target": "projections_events_and_outbox_survive_reopen",